{"format":"flyology.tla.ada-inference/1","module_path":"Counter.tla","configuration":"Counter.cfg","package":"Counter_Model","type_invariant":"TypeOK","input_type_operator":"HarnessInputType","outcome_type_operator":"HarnessOutcomeType","source_sha256":"f2de83b964b04c4faa11c8335dc1c30f4f75bb3a7708bae623b053fae010c8d4","configuration_sha256":"d0189bfff2efbf9a8ee3606e87378f24de9525ededaa54d0b31309721ad95dbf","semantic_xml_sha256":"dbdf896e9151e28511f2296fa4b35c11ef535e7a1e122d8cc963ae0faa760af5","state":[{"variable":"count","ada_field":"Count","type":"integer-range(0..2)","evidence_line":23},{"variable":"lastAction","ada_field":"Last_Action","type":"finite-string-enum","evidence_line":23}],"input":"record","outcome":"record"}
